{
    "$schema": "http://json-schema.org/draft-04/schema#",
    "type": "object",
    "description": "An actual instantiation in time and space of a course",
    "additionalProperties": false,
    "properties": {
        "id": {
            "type": "string",
            "description": "UUID for this listing",
            "$ref": "uuid.json"
        },
        "registrarId": {
            "type": "string",
            "description": "The registration id"
        },
        "externalId": {
            "type": "string",
            "description": "An external identifier associated with this listing"
        },
        "servicepointId": {
            "type": "string",
            "description": "The ID of the service point associated with this listing's reserves",
            "$ref": "uuid.json"
        },
        "locationId": {
            "type": "string",
            "description": "The ID of the location associated with this listing's reserves",
            "$ref": "uuid.json"
        },
        "termId": {
            "type": "string",
            "description": "The ID of the term for this listing",
            "$ref": "uuid.json"
        },
        "termObject": {
            "type": "object",
            "description": "The term associated with this listing",
            "$ref": "term.json"
        },
        "courseTypeId": {
            "type": "string",
            "description": "The ID of the course type for this listing",
            "$ref": "uuid.json"
        },
        "courseTypeObject": {
            "type": "object",
            "description": "The course type associated with this listing",
            "$ref": "coursetype.json"
        },
        "metadata": {
            "type": "object",
            "$ref": "raml-util/schemas/metadata.schema"
        }
    },
    "required": [
        "termId"
    ]
}

