{
  "id": "c03bcba3-a6a0-4251-b316-0631bb2e6f21",
  "registrarId": "external1",
  "externalId": "external2",
  "servicepointId": "3a40852d-49fd-4df2-a1f9-6e2641a6e91f",
  "locationId": "53cf956f-c1df-410b-8bea-27f712cca7c0",
  "termId": "cd1eb7ed-2704-4b6a-9037-d7f1a5351f6b",
  "courseTypeId": "f5063ee8-b18c-402b-b0c9-1b0f93d8570b"
}
